{
  "$schema": "https://persona-atoms.com/schemas/voice-profile-v1.json",
  "type": "voice-profile",
  "id": "conversational-accessible",
  "version": "1.0.0",
  "name": "Conversational Accessible",
  "formality": "conversational",
  "hedging_tolerance": "medium",
  "sentence_length_preference": "short"
}
